<?xml version="1.0" encoding="UTF-8"?>
<test-driver version="1.0" xmlns:xsi="http://www.w3.org/2001/XMLSchema-instance" xsi:noNamespaceSchemaLocation="../testDefinition.xsd">

  <data name="timedInterval">100</data>
  <data name="cacheType">CLIENT</data>

  <data name="distinctKeys">
    <list>
      <item>1848</item>
    </list>
  </data>
  <data name="expectedCount">1848</data>

  <data name="valueSizes">
    <list>
      <item>3000</item>
    </list>
  </data>
  <data name="numThreads">
    <list>
      <item>1</item>
    </list>
  </data>

  <data name="keyType">str</data>

  <data name="ThinClientRegion">
    <snippet>
      <region name="TestTCR1">
        <region-attributes caching-enabled="true"
            initial-capacity="18500" client-notification="true"/>
      </region>
    </snippet>
  </data>
  <data name="regionSpec">ThinClientRegion</data>

  <client-set name="JCS1" hostGroup="CS"/>
  <client-set name="JCS2" hostGroup="CS"/>
  <client-set name="Publisher"/>
  <client-set name="Subscriber"/>

  <test name="ThinClientPerf" description="Thin Client perf test">
    <task name="SetupCacheServer CS1" action="doRunProcess" container="utils" waitTime="5m">
      <data name="program">setupJavaServers</data>
      <data name="arguments">-c 2 Native/csNotifySubscription.xml</data>
      <client-set name="JCS1"/>
    </task>
    <task name="StartCacheServers" action="doRunProcess" container="utils" waitTime="5m" parallel="true">
      <data name="program">startJavaServers</data>
      <data name="arguments">1</data>
      <client-set name="JCS1"/>
    </task>
    <task name="StartCacheServers" action="doRunProcess" container="utils" waitTime="5m" parallel="true">
      <data name="program">startJavaServers</data>
      <data name="arguments">2</data>
      <client-set name="JCS2"/>
    </task>
    <task name="CreateRegion" action="doCreateRegion" container="perftests" waitTime="5m">
      <client-set name="Publisher"/>
      <client-set name="Subscriber"/>
    </task>
    <task name="Populate Entries in publisher" action="doPuts" container="perftests" waitTime="15m">
      <client-set name="Publisher"/>
    </task>
    <task name="Register Interest List" action="doRegisterInterestList" container="perftests" waitTime="15m">
      <data name="registerKeys">1000</data>
      <data name="keyIndexBegin">100</data>
      <client-set name="Subscriber"/>
    </task>
    <task name="Gets Entries in Subscriber" action="doGets" container="perftests" waitTime="15m">
      <client-set name="Subscriber"/>
    </task>
    <task name="Update Entries from Publisher" action="doPuts" container="perftests" waitTime="15m">
      <data name="valueSizes">
        <list>
          <item>500</item>
        </list>
      </data>
      <client-set name="Publisher"/>
    </task>
    <task name="doSleep" action="doSleep" container="utils" waitTime="60">
      <client-set name="Subscriber"/>
      <data name="sleepTime">5</data>
    </task>
    <task name="Verify update list" action="doVerifyInterestList" container="perftests" waitTime="15m">
      <client-set name="Subscriber"/>
      <data name="registerKeys">1000</data>
      <data name="keyIndexBegin">100</data>
      <data name="valueSizes">500</data>
    </task>
    <task name="Close Cache" action="doCloseCache" container="perftests" waitTime="2m"/>
    <task name="StopCacheServers" action="doRunProcess" container="utils" waitTime="5m" parallel="true">
      <data name="program">stopJavaServers</data>
      <data name="arguments">1</data>
      <client-set name="JCS1"/>
    </task>
    <task name="StopCacheServers" action="doRunProcess" container="utils" waitTime="5m" parallel="true">
      <data name="program">stopJavaServers</data>
      <data name="arguments">2</data>
      <client-set name="JCS2"/>
    </task>
  </test>

</test-driver>
