<?xml version="1.0" encoding="UTF-8"?>
<test-driver version="1.0" xmlns:xsi="http://www.w3.org/2001/XMLSchema-instance" xsi:noNamespaceSchemaLocation="../testDefinition.xsd">

  <data name="timedInterval">60</data>
  <data name="cacheType">CLIENT</data>

  <data name="distinctKeys">
    <list>
      <item>100</item>
    </list>
  </data>

  <data name="valueSizes">
    <list>
      <item>10</item>
    </list>
  </data>
  <data name="numThreads">
    <list>
      <item>4</item>
    </list>
  </data>
  <data name="keyType">str</data>
  <data name="clientCount">4</data>
  <data name="serialExecution">true</data>
  <data name="objectType">PdxVersioned</data>
  
  <data name="ThinClientPool1">
    <snippet>
      <pool name="_Test_Pool1" subscription-enabled="true" thread-local-connections="false" min-connections="2" read-timeout="3600000" 
           subscription-redundancy="0" load-conditioning-interval="5000" servers="true" />
    </snippet>
  </data>
  <data name="ThinClientRegion">
    <snippet>
      <region name="TestTCR1">
        <region-attributes caching-enabled="true" pool-name="_Test_Pool1">
        </region-attributes>
      </region>
    </snippet>
  </data>
<data name="EmptyClientRegion">
  <snippet>
    <region name="TestTCR1">
      <region-attributes caching-enabled="false" pool-name="_Test_Pool1">
      </region-attributes>
    </region>
  </snippet>
</data>
                                 

  <client-set name="JCS1" hostGroup="CS"/>
  <client-set name="JCS2" hostGroup="CS"/>
  <client-set name="JCS3" hostGroup="CS"/>
  <client-set count="4" name="Client"/>

  <test name="pdxPutGetMerge" description="This test executes operations on entries on a PartitionedRegion and carefully
validates for correctness. The data store for the partitioned region is spread
across all VMs. The test put one version of pdx class from few clients and get from other clients.">
    <task name="SetupCacheServer CS1" action="doRunProcess" container="utils" waitTime="5m">
      <data name="program">setupJavaServers</data>
      <data name="arguments">-c 3 Generics/parReg/pdx/Pdx/csPartitionRegion.xml</data>
      <client-set name="JCS1"/>
    </task>
    <task name="StartCacheServers" action="doRunProcess" container="utils" waitTime="5m" parallel="true">
      <data name="program">startJavaServers</data>
      <data name="arguments">1</data>
      <client-set name="JCS1"/>
    </task>
    <task name="StartCacheServers" action="doRunProcess" container="utils" waitTime="5m" parallel="true">
      <data name="program">startJavaServers</data>
      <data name="arguments">2</data>
      <client-set name="JCS2"/>
    </task>
    <task name="StartCacheServers" action="doRunProcess" container="utils" waitTime="5m" parallel="true">
      <data name="program">startJavaServers</data>
      <data name="arguments">3</data>
      <client-set name="JCS3"/>
    </task>
    <task name="CreatePool" action="doCreatePool" container="NewFwkLib.GemStone.GemFire.Cache.FwkLib.pdxtests" argTypes="String,Object"  waitTime="3m">
      <data name="poolSpec">ThinClientPool1</data>
      <client-set count="4" name="Client"/>
    </task>
    <task name="CreateRegion" action="doCreateRegion" container="NewFwkLib.GemStone.GemFire.Cache.FwkLib.pdxtests" argTypes="String,Object"  waitTime="5m">
      <client-set begin="1" count="2" name="Client"/>
      <data name="regionSpec">ThinClientRegion</data>
	  <data name="versionNum">1</data>
    </task>
    <task name="CreateRegion" action="doCreateRegion" container="NewFwkLib.GemStone.GemFire.Cache.FwkLib.pdxtests" argTypes="String,Object"  waitTime="5m">
      <client-set begin="3" count="2" name="Client"/>
      <data name="regionSpec">EmptyClientRegion</data>
 	 <!--data name="objectType">PdxVersioned</data-->
	  <data name="versionNum">2</data>
    </task>
    <task name="Create Object" action="doPopulateRegion" container="NewFwkLib.GemStone.GemFire.Cache.FwkLib.pdxtests" waitTime="30m" argTypes="String,Object">
      <data name="entryOps">
        <oneof>
          <item>create</item>
         </oneof>
      </data>
      <data name="versionNum">2</data>
      <client-set begin="3" count="2" name="Client"/>
    </task>
    <task name="Do put" action="doPuts" container="NewFwkLib.GemStone.GemFire.Cache.FwkLib.pdxtests" waitTime="30m" argTypes="String,Object">
      <data name="entryOps">
        <oneof>
          <item>update</item>
         </oneof>
      </data>
      <data name="versionNum">2</data>
      <client-set begin="3" count="2" name="Client"/>
    </task>
    <task name="Do get" action="doGets" container="NewFwkLib.GemStone.GemFire.Cache.FwkLib.pdxtests" waitTime="30m" argTypes="String,Object">
      <data name="entryOps">
        <oneof>
          <item>get</item>
         </oneof>
      </data>
      <client-set begin="1" count="2" name="Client"/>
    </task>
    <task name="ValidateFromSnapshot" action="verifyFromSnapshot" container="NewFwkLib.GemStone.GemFire.Cache.FwkLib.pdxtests" waitTime="30m" argTypes="String,Object">
      <client-set begin="1" count="2" name="Client"/>
    </task>
    <task name="Do Put" action="doPuts" container="NewFwkLib.GemStone.GemFire.Cache.FwkLib.pdxtests" waitTime="30m" argTypes="String,Object">
      <data name="entryOps">
        <oneof>
          <item>update</item>
         </oneof>
      </data>
      <data name="versionNum">1</data>
      <client-set begin="1" count="2" name="Client"/>
    </task>
    <task name="Do Get" action="doGets" container="NewFwkLib.GemStone.GemFire.Cache.FwkLib.pdxtests" waitTime="30m" argTypes="String,Object">
      <data name="entryOps">
        <oneof>
          <item>get</item>
         </oneof>
      </data>
      <client-set begin="3" count="2" name="Client"/>
    </task>
    <task name="ValidateFromSnapshot" action="verifyFromSnapshot" container="NewFwkLib.GemStone.GemFire.Cache.FwkLib.pdxtests" waitTime="30m" argTypes="String,Object">
      <client-set begin="3" count="2" name="Client"/>
    </task>
    <task name="Do Get" action="doGets" container="NewFwkLib.GemStone.GemFire.Cache.FwkLib.pdxtests" waitTime="30m" argTypes="String,Object">
      <data name="entryOps">
        <oneof>
          <item>get</item>
         </oneof>
      </data>
      <client-set begin="1" count="2" name="Client"/>
    </task>
    <task name="ValidateFromSnapshot" action="verifyFromSnapshot" container="NewFwkLib.GemStone.GemFire.Cache.FwkLib.pdxtests" waitTime="30m" argTypes="String,Object">
      <client-set begin="1" count="2" name="Client"/>
    </task>
    <task name="Close Cache" action="doCloseCache" container="NewFwkLib.GemStone.GemFire.Cache.FwkLib.smokeperf" argTypes="String,Object"  waitTime="5m"/>
    <task name="StopCacheServers" action="doRunProcess" container="utils" waitTime="5m" parallel="true">
      <data name="program">stopJavaServers</data>
      <data name="arguments">1</data>
      <client-set name="JCS1"/>
    </task>
    <task name="StopCacheServers" action="doRunProcess" container="utils" waitTime="5m" parallel="true">
      <data name="program">stopJavaServers</data>
      <data name="arguments">2</data>
      <client-set name="JCS2"/>
    </task>
    <task name="StopCacheServers" action="doRunProcess" container="utils" waitTime="5m" parallel="true">
      <data name="program">stopJavaServers</data>
      <data name="arguments">3</data>
      <client-set name="JCS3"/>
    </task>

  </test>

</test-driver>
